{
  "$schema": "https://json-schema.org/draft/2020-12/schema",
  "$id": "https://ricotaarcade.local/schema/skayboy-soluciones/1",
  "title": "CTR-18 — Las soluciones grabadas de Skayboy y Poligirl",
  "comment": "Lo que este schema NO hace, y hay que saberlo antes de confiar en él: no juega las trazas, no sabe si cada nivel de skayboy.json tiene la suya, no detecta dos renglones seguidos iguales ni mide la tolerancia o la paridad. Todo eso vive en src/lib/skayboy/soluciones.test.ts (CTR-18.6). Este archivo lo escribe scripts/resolver-niveles.mjs y no lo importa ninguna página: la traza no viaja al teléfono (ADR-09.2).",
  "type": "object",
  "additionalProperties": false,
  "required": ["contrato", "contratoVersion", "juego", "actualizado", "cuadrosPorSegundo", "soluciones"],
  "properties": {
    "contrato": { "const": "CTR-18" },
    "contratoVersion": { "const": 1 },
    "juego": { "const": "skayboy" },
    "actualizado": { "type": "string", "pattern": "^\\d{4}-\\d{2}-\\d{2}$" },
    "cuadrosPorSegundo": {
      "comment": "La unidad de todas las trazas: un cuadro es 1/60 s (ADR-09.1). No es un derivado: es como `tile` en CTR-16.2. soluciones.test.ts la compara con CUADRO_SEG de mundo.ts; cambiarla es regrabar todo y subir de versión.",
      "const": 60
    },
    "soluciones": {
      "comment": "Un mapa y no un arreglo, por lo mismo que la leyenda de CTR-16.4: dos soluciones para el mismo nivel no se pueden escribir.",
      "type": "object",
      "minProperties": 1,
      "propertyNames": { "pattern": "^NIV-\\d{2}$" },
      "additionalProperties": { "$ref": "#/$defs/solucion" }
    }
  },
  "$defs": {
    "solucion": {
      "type": "object",
      "additionalProperties": false,
      "required": ["deUno"],
      "properties": {
        "deUno": { "$ref": "#/$defs/trazaDeUno" }
      }
    },
    "trazaDeUno": {
      "comment": "CTR-18.3. Un renglón nombra una columna o ninguna: dos columnas en el mismo cuadro no se pueden escribir, y eso es lo que hace de esta la traza de una persona sola (BR-25 b). El pattern es la misma cadena que la expresión de src/lib/skayboy/soluciones.ts, y el test compara las dos. El tope de 400 renglones no es un número de diseño: es el que mantiene el test dentro de su presupuesto (CTR-18.7).",
      "type": "array",
      "minItems": 1,
      "maxItems": 400,
      "items": {
        "type": "string",
        "pattern": "^(?:([sp])(<\\^|>\\^|<|>|\\^)|-) ([1-9][0-9]{0,3})$"
      }
    }
  }
}
